CPU: ID 0x306a9, Processor Type 0x0, Family 0x6, Model 0x3a, Stepping 0x9
Northbridge: 8086:0154 (3rd generation (Ivy Bridge family) Core Processor)
Southbridge: 8086:1e59 (HM76)

============= GPIOS =============

GPIOBASE = 0x0500 (IO)

gpiobase+0x0000: 0x3f7b9de7 (GPIO_USE_SEL)
gpiobase+0x0000: 0xb96ba1ff (GPIO_USE_SEL) DEFAULT
gpiobase+0x0000: 0x86103c18 (GPIO_USE_SEL) DIFF
gpiobase+0x0004: 0xa08ec784 (GP_IO_SEL)
gpiobase+0x0004: 0xeeff6eff (GP_IO_SEL) DEFAULT
gpiobase+0x0004: 0x4e71a97b (GP_IO_SEL) DIFF
gpiobase+0x0008: 0x00000000 (RESERVED)
gpiobase+0x000c: 0xc1ccc69c (GP_LVL)
gpiobase+0x000c: 0x02fe0100 (GP_LVL) DEFAULT
gpiobase+0x000c: 0xc332c79c (GP_LVL) DIFF
gpiobase+0x0010: 0x00000000 (RESERVED)
gpiobase+0x0014: 0x00000000 (RESERVED)
gpiobase+0x0018: 0x00000000 (GPO_BLINK)
gpiobase+0x0018: 0x00040000 (GPO_BLINK) DEFAULT
gpiobase+0x0018: 0x00040000 (GPO_BLINK) DIFF
gpiobase+0x001c: 0x00000000 (GP_SER_BLINK)
gpiobase+0x0020: 0x00080000 (GP_SB_CMDSTS)
gpiobase+0x0024: 0x00000000 (GP_SB_DATA)
gpiobase+0x0028: 0x0000     (GPI_NMI_EN)
gpiobase+0x002a: 0x0000     (GPI_NMI_STS)
gpiobase+0x002c: 0x00008180 (GPI_INV)
gpiobase+0x002c: 0x00000000 (GPI_INV) DEFAULT
gpiobase+0x002c: 0x00008180 (GPI_INV) DIFF
gpiobase+0x0030: 0x13ff70fe (GPIO_USE_SEL2)
gpiobase+0x0030: 0x020300fe (GPIO_USE_SEL2) DEFAULT
gpiobase+0x0030: 0x11fc7000 (GPIO_USE_SEL2) DIFF
gpiobase+0x0034: 0x0c008f40 (GP_IO_SEL2)
gpiobase+0x0034: 0x1f57fff4 (GP_IO_SEL2) DEFAULT
gpiobase+0x0034: 0x135770b4 (GP_IO_SEL2) DIFF
gpiobase+0x0038: 0xbc808f44 (GP_LVL2)
gpiobase+0x0038: 0xa4aa0007 (GP_LVL2) DEFAULT
gpiobase+0x0038: 0x182a8f43 (GP_LVL2) DIFF
gpiobase+0x003c: 0x00000000 (RESERVED)
gpiobase+0x0040: 0x000001f8 (GPIO_USE_SEL3)
gpiobase+0x0040: 0x00000030 (GPIO_USE_SEL3) DEFAULT
gpiobase+0x0040: 0x000001c8 (GPIO_USE_SEL3) DIFF
gpiobase+0x0044: 0x00000ee8 (GPIO_SEL3)
gpiobase+0x0044: 0x00000ff0 (GPIO_SEL3) DEFAULT
gpiobase+0x0044: 0x00000118 (GPIO_SEL3) DIFF
gpiobase+0x0048: 0x00000e0f (GPIO_LVL3)
gpiobase+0x0048: 0x000000c0 (GPIO_LVL3) DEFAULT
gpiobase+0x0048: 0x00000ecf (GPIO_LVL3) DIFF
gpiobase+0x004c: 0x00000000 (RESERVED)
gpiobase+0x0050: 0x00000000 (RESERVED)
gpiobase+0x0054: 0x00000000 (RESERVED)
gpiobase+0x0058: 0x00000000 (RESERVED)
gpiobase+0x005c: 0x00000000 (RESERVED)
gpiobase+0x0060: 0x01000000 (GP_RST_SEL1)
gpiobase+0x0064: 0x00000000 (GP_RST_SEL2)
gpiobase+0x0068: 0x00000000 (GP_RST_SEL3)
gpiobase+0x006c: 0x00000000 (RESERVED)
gpiobase+0x0070: 0x00000000 (RESERVED)
gpiobase+0x0074: 0x00000000 (RESERVED)
gpiobase+0x0078: 0x00000000 (RESERVED)
gpiobase+0x007c: 0x00000000 (RESERVED)



============= RCBA ==============

Error mapping physical memory 0xfed1c000[0x4000]
