CPU: ID 0x306a9, Processor Type 0x0, Family 0x6, Model 0x3a, Stepping 0x9
Northbridge: 8086:0154 (3rd generation (Ivy Bridge family) Core Processor)
Southbridge: 8086:1e59 (HM76)

============= GPIOS =============

GPIOBASE = 0x0500 (IO)

gpiobase+0x0000: 0x39cbb9bf (GPIO_USE_SEL)
gpiobase+0x0000: 0xb96ba1ff (GPIO_USE_SEL) DEFAULT
gpiobase+0x0000: 0x80a01840 (GPIO_USE_SEL) DIFF
gpiobase+0x0004: 0x8635cecb (GP_IO_SEL)
gpiobase+0x0004: 0xeeff6eff (GP_IO_SEL) DEFAULT
gpiobase+0x0004: 0x68caa034 (GP_IO_SEL) DIFF
gpiobase+0x0008: 0x00000000 (RESERVED)
gpiobase+0x000c: 0xf4e5ff78 (GP_LVL)
gpiobase+0x000c: 0x02fe0100 (GP_LVL) DEFAULT
gpiobase+0x000c: 0xf61bfe78 (GP_LVL) DIFF
gpiobase+0x0010: 0x00000000 (RESERVED)
gpiobase+0x0014: 0x00000000 (RESERVED)
gpiobase+0x0018: 0x00000000 (GPO_BLINK)
gpiobase+0x0018: 0x00040000 (GPO_BLINK) DEFAULT
gpiobase+0x0018: 0x00040000 (GPO_BLINK) DIFF
gpiobase+0x001c: 0x00000000 (GP_SER_BLINK)
gpiobase+0x0020: 0x00080000 (GP_SB_CMDSTS)
gpiobase+0x0024: 0x00000000 (GP_SB_DATA)
gpiobase+0x0028: 0x0000     (GPI_NMI_EN)
gpiobase+0x002a: 0x0000     (GPI_NMI_STS)
gpiobase+0x002c: 0x00008908 (GPI_INV)
gpiobase+0x002c: 0x00000000 (GPI_INV) DEFAULT
gpiobase+0x002c: 0x00008908 (GPI_INV) DIFF
gpiobase+0x0030: 0xb3df40fe (GPIO_USE_SEL2)
gpiobase+0x0030: 0x020300fe (GPIO_USE_SEL2) DEFAULT
gpiobase+0x0030: 0xb1dc4000 (GPIO_USE_SEL2) DIFF
gpiobase+0x0034: 0x0c02bffc (GP_IO_SEL2)
gpiobase+0x0034: 0x1f57fff4 (GP_IO_SEL2) DEFAULT
gpiobase+0x0034: 0x13554008 (GP_IO_SEL2) DIFF
gpiobase+0x0038: 0xbfe77fda (GP_LVL2)
gpiobase+0x0038: 0xa4aa0007 (GP_LVL2) DEFAULT
gpiobase+0x0038: 0x1b4d7fdd (GP_LVL2) DIFF
gpiobase+0x003c: 0x00000000 (RESERVED)
gpiobase+0x0040: 0x000007f9 (GPIO_USE_SEL3)
gpiobase+0x0040: 0x00000030 (GPIO_USE_SEL3) DEFAULT
gpiobase+0x0040: 0x000007c9 (GPIO_USE_SEL3) DIFF
gpiobase+0x0044: 0x00000828 (GPIO_SEL3)
gpiobase+0x0044: 0x00000ff0 (GPIO_SEL3) DEFAULT
gpiobase+0x0044: 0x000007d8 (GPIO_SEL3) DIFF
gpiobase+0x0048: 0x00000ef7 (GPIO_LVL3)
gpiobase+0x0048: 0x000000c0 (GPIO_LVL3) DEFAULT
gpiobase+0x0048: 0x00000e37 (GPIO_LVL3) DIFF
gpiobase+0x004c: 0x00000000 (RESERVED)
gpiobase+0x0050: 0x00000000 (RESERVED)
gpiobase+0x0054: 0x00000000 (RESERVED)
gpiobase+0x0058: 0x00000000 (RESERVED)
gpiobase+0x005c: 0x00000000 (RESERVED)
gpiobase+0x0060: 0x01000000 (GP_RST_SEL1)
gpiobase+0x0064: 0x00000000 (GP_RST_SEL2)
gpiobase+0x0068: 0x00000000 (GP_RST_SEL3)
gpiobase+0x006c: 0x00000000 (RESERVED)
gpiobase+0x0070: 0x00000000 (RESERVED)
gpiobase+0x0074: 0x00000000 (RESERVED)
gpiobase+0x0078: 0x00000000 (RESERVED)
gpiobase+0x007c: 0x00000000 (RESERVED)



============= RCBA ==============

RCBA = 0xfed1c000 (MEM)

0x0050: 0x812a0654
0x0054: 0x00000789
0x0400: 0x00000500
0x0404: 0x76543210
0x0800: 0x20100808
0x0804: 0x01000404
0x0808: 0x04210444
0x080c: 0x01110000
0x0810: 0x00660000
0x0818: 0x00170017
0x081c: 0x00000f0f
0x0820: 0xf7401111
0x0824: 0x11111111
0x0834: 0x0003303c
0x0838: 0x04124054
0x0900: 0x00004000
0x0984: 0x00100000
0x0988: 0x00400010
0x098c: 0x00440000
0x0990: 0x00002000
0x0994: 0x00006000
0x09b0: 0x00000004
0x1000: 0x20100808
0x1004: 0x01000404
0x1008: 0x04210444
0x100c: 0x01110000
0x1010: 0x00007731
0x1020: 0x20100808
0x1024: 0x01000404
0x1028: 0x04210f11
0x102c: 0x04210000
0x1030: 0x00040010
0x1034: 0x0003303c
0x1038: 0x045a419a
0x1100: 0x00006000
0x1104: 0x00000700
0x1114: 0x00000005
0x1194: 0x00002000
0x1d48: 0x00030000
0x1e80: 0x00fc1001
0x1e84: 0x000200f0
0x2014: 0x80000019
0x2020: 0x81000022
0x2030: 0x82000044
0x2040: 0x87000080
0x2088: 0x00109000
0x2094: 0x00002000
0x20ac: 0x40000000
0x21a4: 0x00023c42
0x21a8: 0x40420003
0x21b0: 0x00000002
0x2230: 0x00010000
0x2234: 0x0000000f
0x2238: 0x00000941
0x2240: 0x00a205b7
0x2244: 0x00ae05f7
0x2248: 0x00450f23
0x224c: 0x00b30000
0x2250: 0x00bf0000
0x2254: 0x001d0a4d
0x2258: 0x001c01f8
0x2260: 0x00920d9f
0x2268: 0x000c0028
0x2270: 0x000c0000
0x2274: 0x00100040
0x2278: 0x000f02ae
0x227c: 0x001b02d6
0x2280: 0x003d0000
0x2284: 0x00490000
0x2288: 0x006202ec
0x228c: 0x00000001
0x2294: 0x00c60b18
0x2298: 0x00d20b40
0x229c: 0x007c0000
0x22a0: 0x00870000
0x22a4: 0x008c0e30
0x2304: 0xc03b8400
0x2308: 0x28000016
0x230c: 0x4abcb5bc
0x2310: 0xa809605b
0x2314: 0x0a2c0020
0x2318: 0x04c8f72f
0x231c: 0x03d3072f
0x2320: 0x00008002
0x2324: 0x00854c74
0x2328: 0x00421731
0x2330: 0xea004000
0x2334: 0x00000084
0x2338: 0x00000600
0x2340: 0x003a001b
0x2344: 0xff0c000c
0x3020: 0xffffffff
0x3024: 0xffffffff
0x3028: 0xffffffff
0x302c: 0xffffffff
0x3030: 0xffffffff
0x3034: 0xffffffff
0x3038: 0xffffffff
0x303c: 0xffffffff
0x3040: 0xffffffff
0x3044: 0xffffffff
0x3048: 0xffffffff
0x304c: 0xffffffff
0x3050: 0xffffffff
0x3054: 0xffffffff
0x3058: 0xffffffff
0x305c: 0xffffffff
0x3060: 0xffffffff
0x3064: 0xffffffff
0x3068: 0xffffffff
0x306c: 0xffffffff
0x3070: 0xffffffff
0x3074: 0xffffffff
0x3078: 0xffffffff
0x307c: 0xffffffff
0x3080: 0xffffffff
0x3084: 0xffffffff
0x3088: 0xffffffff
0x308c: 0xffffffff
0x3090: 0xffffffff
0x3094: 0xffffffff
0x3098: 0xffffffff
0x309c: 0xffffffff
0x30a0: 0xffffffff
0x30a4: 0xffffffff
0x30a8: 0xffffffff
0x30ac: 0xffffffff
0x30b0: 0xffffffff
0x30b4: 0xffffffff
0x30b8: 0xffffffff
0x30bc: 0xffffffff
0x30c0: 0xffffffff
0x30c4: 0xffffffff
0x30c8: 0xffffffff
0x30cc: 0xffffffff
0x30d0: 0xffffffff
0x30d4: 0xffffffff
0x30d8: 0xffffffff
0x30dc: 0xffffffff
0x30e0: 0xffffffff
0x30e4: 0xffffffff
0x30e8: 0xffffffff
0x30ec: 0xffffffff
0x30f0: 0xffffffff
0x30f4: 0xffffffff
0x30f8: 0xffffffff
0x30fc: 0xffffffff
0x3100: 0x01143200
0x3108: 0x00014321
0x310c: 0x00214321
0x3110: 0x00000001
0x3114: 0x00004321
0x3118: 0x00000001
0x311c: 0x00000001
0x3124: 0x00002321
0x3128: 0x00000021
0x3140: 0x00000335
0x3144: 0x32010237
0x3148: 0x00003216
0x314c: 0x00002350
0x3150: 0x00007654
0x3154: 0x00003210
0x315c: 0x00003210
0x3160: 0x00003210
0x31fc: 0x03000000
0x3310: 0x03040100
0x3314: 0x0000000f
0x3318: 0x054f0000
0x331c: 0x80000000
0x3320: 0x00000003
0x3324: 0x04000000
0x3340: 0x000fffff
0x3344: 0x00000003
0x3360: 0x0001c000
0x3368: 0x00061100
0x3378: 0x7f8fdfff
0x337c: 0x000003fd
0x3388: 0x00001000
0x3390: 0x0001c000
0x33a0: 0x00000800
0x33a4: 0x00000001
0x33b0: 0x00001000
0x33c0: 0x00093900
0x33cc: 0x24653002
0x33d0: 0x067388fe
0x33d4: 0x00670060
0x33d8: 0x07ffffff
0x33f0: 0x30002de4
0x3400: 0x0000001c
0x3404: 0x00000080
0x3410: 0x00000c21
0x3418: 0x1ff81fe3
0x341c: 0xbf4f001f
0x3424: 0x00060010
0x3428: 0x0000001d
0x3450: 0xfed04000
0x3458: 0xffffffff
0x345c: 0xffffffff
0x3460: 0xffffffff
0x3464: 0xffffffff
0x3468: 0xffffffff
0x346c: 0xffffffff
0x3470: 0xffffffff
0x3474: 0xffffffff
0x3478: 0xffffffff
0x347c: 0xffffffff
0x3480: 0xffffffff
0x3484: 0xffffffff
0x3488: 0xffffffff
0x348c: 0xffffffff
0x3490: 0xffffffff
0x3494: 0xffffffff
0x3498: 0xffffffff
0x349c: 0xffffffff
0x34a0: 0xffffffff
0x34a4: 0xffffffff
0x34a8: 0xffffffff
0x34ac: 0xffffffff
0x34b0: 0xffffffff
0x34b4: 0xffffffff
0x34b8: 0xffffffff
0x34bc: 0xffffffff
0x34c0: 0xffffffff
0x34c4: 0xffffffff
0x34c8: 0xffffffff
0x34cc: 0xffffffff
0x34d0: 0xffffffff
0x34d4: 0xffffffff
0x34d8: 0xffffffff
0x34dc: 0xffffffff
0x34e0: 0xffffffff
0x34e4: 0xffffffff
0x34e8: 0xffffffff
0x34ec: 0xffffffff
0x34f0: 0xffffffff
0x34f4: 0xffffffff
0x34f8: 0xffffffff
0x34fc: 0xffffffff
0x3500: 0x20000153
0x3504: 0x20000153
0x3508: 0x20000153
0x350c: 0x20000f57
0x3510: 0x20000153
0x3514: 0x20000f57
0x3518: 0x20000153
0x351c: 0x20000153
0x3520: 0x20000153
0x3524: 0x20000f57
0x3528: 0x20000153
0x352c: 0x20000153
0x3530: 0x60000f57
0x3534: 0x60000f57
0x3560: 0x024c8001
0x3564: 0x000024a3
0x3568: 0x00040002
0x356c: 0x01000050
0x3570: 0x02000772
0x3574: 0x16000f87
0x3578: 0x1800ff4f
0x357c: 0x0001d630
0x359c: 0x000034f0
0x35a0: 0xc0300c03
0x35a4: 0x00300c03
0x3600: 0xffffffff
0x3604: 0xffffffff
0x3608: 0xffffffff
0x360c: 0xffffffff
0x3610: 0xffffffff
0x3614: 0xffffffff
0x3618: 0xffffffff
0x361c: 0xffffffff
0x3620: 0xffffffff
0x3624: 0xffffffff
0x3628: 0xffffffff
0x362c: 0xffffffff
0x3630: 0xffffffff
0x3634: 0xffffffff
0x3638: 0xffffffff
0x363c: 0xffffffff
0x3640: 0xffffffff
0x3644: 0xffffffff
0x3648: 0xffffffff
0x364c: 0xffffffff
0x3650: 0xffffffff
0x3654: 0xffffffff
0x3658: 0xffffffff
0x365c: 0xffffffff
0x3660: 0xffffffff
0x3664: 0xffffffff
0x3668: 0xffffffff
0x366c: 0xffffffff
0x3670: 0xffffffff
0x3674: 0xffffffff
0x3678: 0xffffffff
0x367c: 0xffffffff
0x3680: 0xffffffff
0x3684: 0xffffffff
0x3688: 0xffffffff
0x368c: 0xffffffff
0x3690: 0xffffffff
0x3694: 0xffffffff
0x3698: 0xffffffff
0x369c: 0xffffffff
0x36a0: 0xffffffff
0x36a4: 0xffffffff
0x36a8: 0xffffffff
0x36ac: 0xffffffff
0x36b0: 0xffffffff
0x36b4: 0xffffffff
0x36b8: 0xffffffff
0x36bc: 0xffffffff
0x36c0: 0xffffffff
0x36c4: 0xffffffff
0x36c8: 0xffffffff
0x36cc: 0xffffffff
0x36d0: 0xffffffff
0x36d4: 0xffffffff
0x36d8: 0xffffffff
0x36dc: 0xffffffff
0x36e0: 0xffffffff
0x36e4: 0xffffffff
0x36e8: 0xffffffff
0x36ec: 0xffffffff
0x36f0: 0xffffffff
0x36f4: 0xffffffff
0x36f8: 0xffffffff
0x36fc: 0xffffffff
0x3700: 0xffffffff
0x3704: 0xffffffff
0x3708: 0xffffffff
0x370c: 0xffffffff
0x3710: 0xffffffff
0x3714: 0xffffffff
0x3718: 0xffffffff
0x371c: 0xffffffff
0x3720: 0xffffffff
0x3724: 0xffffffff
0x3728: 0xffffffff
0x372c: 0xffffffff
0x3730: 0xffffffff
0x3734: 0xffffffff
0x3738: 0xffffffff
0x373c: 0xffffffff
0x3740: 0xffffffff
0x3744: 0xffffffff
0x3748: 0xffffffff
0x374c: 0xffffffff
0x3750: 0xffffffff
0x3754: 0xffffffff
0x3758: 0xffffffff
0x375c: 0xffffffff
0x3760: 0xffffffff
0x3764: 0xffffffff
0x3768: 0xffffffff
0x376c: 0xffffffff
0x3770: 0xffffffff
0x3774: 0xffffffff
0x3778: 0xffffffff
0x377c: 0xffffffff
0x3780: 0xffffffff
0x3784: 0xffffffff
0x3788: 0xffffffff
0x378c: 0xffffffff
0x3790: 0xffffffff
0x3794: 0xffffffff
0x3798: 0xffffffff
0x379c: 0xffffffff
0x37a0: 0xffffffff
0x37a4: 0xffffffff
0x37a8: 0xffffffff
0x37ac: 0xffffffff
0x37b0: 0xffffffff
0x37b4: 0xffffffff
0x37b8: 0xffffffff
0x37bc: 0xffffffff
0x37c0: 0xffffffff
0x37c4: 0xffffffff
0x37c8: 0xffffffff
0x37cc: 0xffffffff
0x37d0: 0xffffffff
0x37d4: 0xffffffff
0x37d8: 0xffffffff
0x37dc: 0xffffffff
0x37e0: 0xffffffff
0x37e4: 0xffffffff
0x37e8: 0xffffffff
0x37ec: 0xffffffff
0x37f0: 0xffffffff
0x37f4: 0xffffffff
0x37f8: 0xffffffff
0x37fc: 0xffffffff
0x3800: 0x05ff0200
0x3804: 0x0004e008
0x3808: 0x00562c97
0x3810: 0x006f003c
0x3814: 0x0074006f
0x3818: 0x0072004f
0x381c: 0x00650064
0x3820: 0x00000072
0x3824: 0x00020003
0x3828: 0x00010000
0x382c: 0x20022001
0x3830: 0x00002003
0x3834: 0x00000014
0x3838: 0x0000000e
0x383c: 0x8be4df61
0x3840: 0x11d293ca
0x3844: 0xe0000daa
0x3848: 0x002b0398
0x3850: 0x00000a0b
0x3858: 0x05ff0200
0x385c: 0x01ff0001
0x3860: 0x00001fff
0x3864: 0x00001fff
0x3890: 0xf8420480
0x3894: 0x527c5006
0x3898: 0x0102209f
0x389c: 0x00000503
0x38b0: 0x00003000
0x38b4: 0x0a0b0000
0x38c0: 0x00000007
0x38c4: 0x00802005
0x38c8: 0x00002005
0x38f0: 0x00000001
0x3a00: 0x03020100
0x3a04: 0x07060504
0x3a08: 0x0b0a0908
0x3a0c: 0x0f0e0d0c
0x3a20: 0x06060606
0x3a24: 0x00000606
0x3a28: 0x01010000
0x3a2c: 0x01010404
0x3a60: 0x00000490
0x3a6c: 0x00000001
0x3a80: 0x01040000
0x3a84: 0x00001001
0x3a88: 0x00000001
0x3b00: 0xffffffff
0x3b04: 0xffffffff
0x3b08: 0xffffffff
0x3b0c: 0xffffffff
0x3b10: 0xffffffff
0x3b14: 0xffffffff
0x3b18: 0xffffffff
0x3b1c: 0xffffffff
0x3b20: 0xffffffff
0x3b24: 0xffffffff
0x3b28: 0xffffffff
0x3b2c: 0xffffffff
0x3b30: 0xffffffff
0x3b34: 0xffffffff
0x3b38: 0xffffffff
0x3b3c: 0xffffffff
0x3b40: 0xffffffff
0x3b44: 0xffffffff
0x3b48: 0xffffffff
0x3b4c: 0xffffffff
0x3b50: 0xffffffff
0x3b54: 0xffffffff
0x3b58: 0xffffffff
0x3b5c: 0xffffffff
0x3b60: 0xffffffff
0x3b64: 0xffffffff
0x3b68: 0xffffffff
0x3b6c: 0xffffffff
0x3b70: 0xffffffff
0x3b74: 0xffffffff
0x3b78: 0xffffffff
0x3b7c: 0xffffffff
0x3b80: 0xffffffff
0x3b84: 0xffffffff
0x3b88: 0xffffffff
0x3b8c: 0xffffffff
0x3b90: 0xffffffff
0x3b94: 0xffffffff
0x3b98: 0xffffffff
0x3b9c: 0xffffffff
0x3ba0: 0xffffffff
0x3ba4: 0xffffffff
0x3ba8: 0xffffffff
0x3bac: 0xffffffff
0x3bb0: 0xffffffff
0x3bb4: 0xffffffff
0x3bb8: 0xffffffff
0x3bbc: 0xffffffff
0x3bc0: 0xffffffff
0x3bc4: 0xffffffff
0x3bc8: 0xffffffff
0x3bcc: 0xffffffff
0x3bd0: 0xffffffff
0x3bd4: 0xffffffff
0x3bd8: 0xffffffff
0x3bdc: 0xffffffff
0x3be0: 0xffffffff
0x3be4: 0xffffffff
0x3be8: 0xffffffff
0x3bec: 0xffffffff
0x3bf0: 0xffffffff
0x3bf4: 0xffffffff
0x3bf8: 0xffffffff
0x3bfc: 0xffffffff
0x3c00: 0xffffffff
0x3c04: 0xffffffff
0x3c08: 0xffffffff
0x3c0c: 0xffffffff
0x3c10: 0xffffffff
0x3c14: 0xffffffff
0x3c18: 0xffffffff
0x3c1c: 0xffffffff
0x3c20: 0xffffffff
0x3c24: 0xffffffff
0x3c28: 0xffffffff
0x3c2c: 0xffffffff
0x3c30: 0xffffffff
0x3c34: 0xffffffff
0x3c38: 0xffffffff
0x3c3c: 0xffffffff
0x3c40: 0xffffffff
0x3c44: 0xffffffff
0x3c48: 0xffffffff
0x3c4c: 0xffffffff
0x3c50: 0xffffffff
0x3c54: 0xffffffff
0x3c58: 0xffffffff
0x3c5c: 0xffffffff
0x3c60: 0xffffffff
0x3c64: 0xffffffff
0x3c68: 0xffffffff
0x3c6c: 0xffffffff
0x3c70: 0xffffffff
0x3c74: 0xffffffff
0x3c78: 0xffffffff
0x3c7c: 0xffffffff
0x3c80: 0xffffffff
0x3c84: 0xffffffff
0x3c88: 0xffffffff
0x3c8c: 0xffffffff
0x3c90: 0xffffffff
0x3c94: 0xffffffff
0x3c98: 0xffffffff
0x3c9c: 0xffffffff
0x3ca0: 0xffffffff
0x3ca4: 0xffffffff
0x3ca8: 0xffffffff
0x3cac: 0xffffffff
0x3cb0: 0xffffffff
0x3cb4: 0xffffffff
0x3cb8: 0xffffffff
0x3cbc: 0xffffffff
0x3cc0: 0xffffffff
0x3cc4: 0xffffffff
0x3cc8: 0xffffffff
0x3ccc: 0xffffffff
0x3cd0: 0xffffffff
0x3cd4: 0xffffffff
0x3cd8: 0xffffffff
0x3cdc: 0xffffffff
0x3ce0: 0xffffffff
0x3ce4: 0xffffffff
0x3ce8: 0xffffffff
0x3cec: 0xffffffff
0x3cf0: 0xffffffff
0x3cf4: 0xffffffff
0x3cf8: 0xffffffff
0x3cfc: 0xffffffff
0x3d00: 0xffffffff
0x3d04: 0xffffffff
0x3d08: 0xffffffff
0x3d0c: 0xffffffff
0x3d10: 0xffffffff
0x3d14: 0xffffffff
0x3d18: 0xffffffff
0x3d1c: 0xffffffff
0x3d20: 0xffffffff
0x3d24: 0xffffffff
0x3d28: 0xffffffff
0x3d2c: 0xffffffff
0x3d30: 0xffffffff
0x3d34: 0xffffffff
0x3d38: 0xffffffff
0x3d3c: 0xffffffff
0x3d40: 0xffffffff
0x3d44: 0xffffffff
0x3d48: 0xffffffff
0x3d4c: 0xffffffff
0x3d50: 0xffffffff
0x3d54: 0xffffffff
0x3d58: 0xffffffff
0x3d5c: 0xffffffff
0x3d60: 0xffffffff
0x3d64: 0xffffffff
0x3d68: 0xffffffff
0x3d6c: 0xffffffff
0x3d70: 0xffffffff
0x3d74: 0xffffffff
0x3d78: 0xffffffff
0x3d7c: 0xffffffff
0x3d80: 0xffffffff
0x3d84: 0xffffffff
0x3d88: 0xffffffff
0x3d8c: 0xffffffff
0x3d90: 0xffffffff
0x3d94: 0xffffffff
0x3d98: 0xffffffff
0x3d9c: 0xffffffff
0x3da0: 0xffffffff
0x3da4: 0xffffffff
0x3da8: 0xffffffff
0x3dac: 0xffffffff
0x3db0: 0xffffffff
0x3db4: 0xffffffff
0x3db8: 0xffffffff
0x3dbc: 0xffffffff
0x3dc0: 0xffffffff
0x3dc4: 0xffffffff
0x3dc8: 0xffffffff
0x3dcc: 0xffffffff
0x3dd0: 0xffffffff
0x3dd4: 0xffffffff
0x3dd8: 0xffffffff
0x3ddc: 0xffffffff
0x3de0: 0xffffffff
0x3de4: 0xffffffff
0x3de8: 0xffffffff
0x3dec: 0xffffffff
0x3df0: 0xffffffff
0x3df4: 0xffffffff
0x3df8: 0xffffffff
0x3dfc: 0xffffffff
0x3e00: 0xffffffff
0x3e04: 0xffffffff
0x3e08: 0xffffffff
0x3e0c: 0xffffffff
0x3e10: 0xffffffff
0x3e14: 0xffffffff
0x3e18: 0xffffffff
0x3e1c: 0xffffffff
0x3e20: 0xffffffff
0x3e24: 0xffffffff
0x3e28: 0xffffffff
0x3e2c: 0xffffffff
0x3e30: 0xffffffff
0x3e34: 0xffffffff
0x3e38: 0xffffffff
0x3e3c: 0xffffffff
0x3e40: 0xffffffff
0x3e44: 0xffffffff
0x3e48: 0xffffffff
0x3e4c: 0xffffffff
0x3e50: 0xffffffff
0x3e54: 0xffffffff
0x3e58: 0xffffffff
0x3e5c: 0xffffffff
0x3e60: 0xffffffff
0x3e64: 0xffffffff
0x3e68: 0xffffffff
0x3e6c: 0xffffffff
0x3e70: 0xffffffff
0x3e74: 0xffffffff
0x3e78: 0xffffffff
0x3e7c: 0xffffffff
0x3e80: 0xffffffff
0x3e84: 0xffffffff
0x3e88: 0xffffffff
0x3e8c: 0xffffffff
0x3e90: 0xffffffff
0x3e94: 0xffffffff
0x3e98: 0xffffffff
0x3e9c: 0xffffffff
0x3ea0: 0xffffffff
0x3ea4: 0xffffffff
0x3ea8: 0xffffffff
0x3eac: 0xffffffff
0x3eb0: 0xffffffff
0x3eb4: 0xffffffff
0x3eb8: 0xffffffff
0x3ebc: 0xffffffff
0x3ec0: 0xffffffff
0x3ec4: 0xffffffff
0x3ec8: 0xffffffff
0x3ecc: 0xffffffff
0x3ed0: 0xffffffff
0x3ed4: 0xffffffff
0x3ed8: 0xffffffff
0x3edc: 0xffffffff
0x3ee0: 0xffffffff
0x3ee4: 0xffffffff
0x3ee8: 0xffffffff
0x3eec: 0xffffffff
0x3ef0: 0xffffffff
0x3ef4: 0xffffffff
0x3ef8: 0xffffffff
0x3efc: 0xffffffff
0x3f00: 0x0000010b



============= PMBASE ============

PMBASE = 0x0400 (IO)

pmbase+0x0000: 0x0001     (PM1_STS)
pmbase+0x0002: 0x0120     (PM1_EN)
pmbase+0x0004: 0x00000001 (PM1_CNT)
pmbase+0x0008: 0x00cff699 (PM1_TMR)
pmbase+0x000c: 0x00000000 (RESERVED)
pmbase+0x0010: 0x00000000 (RESERVED)
pmbase+0x0014: 0x00000000 (RESERVED)
pmbase+0x0018: 0x00000000 (RESERVED)
pmbase+0x001c: 0x00000000 (RESERVED)
pmbase+0x0020: 0xc6400000 (GPE0_STS)
               0x00000008
pmbase+0x0028: 0x08082246 (GPE0_EN)
               0x00000000
pmbase+0x0030: 0x00002033 (SMI_EN)
pmbase+0x0034: 0x00004900 (SMI_STS)
pmbase+0x0038: 0x8000     (ALT_GP_SMI_EN)
pmbase+0x003a: 0x4e40     (ALT_GP_SMI_STS)
pmbase+0x003c: 0x00       (UPRWC)
pmbase+0x003d: 0x01       (RESERVED)
pmbase+0x003e: 0x0000     (RESERVED)
pmbase+0x0040: 0x0000     (RESERVED)
pmbase+0x0042: 0x00       (GPE_CNTL)
pmbase+0x0043: 0x00       (RESERVED)
pmbase+0x0044: 0x12e0     (DEVACT_STS)
pmbase+0x0046: 0x0000     (RESERVED)
pmbase+0x0048: 0x00000000 (RESERVED)
pmbase+0x004c: 0x00000000 (RESERVED)
pmbase+0x0050: 0x00       (PM2_CNT)
pmbase+0x0051: 0x00       (RESERVED)
pmbase+0x0052: 0x0000     (RESERVED)
pmbase+0x0054: 0x00002000 (RESERVED)
pmbase+0x0058: 0x00000000 (RESERVED)
pmbase+0x005c: 0x00000000 (RESERVED)
pmbase+0x0060: 0x0004     (TCO_RLD)
pmbase+0x0062: 0x00       (TCO_DAT_IN)
pmbase+0x0063: 0x00       (TCO_DAT_OUT)
pmbase+0x0064: 0x0000     (TCO1_STS)
pmbase+0x0066: 0x0000     (TCO2_STS)
pmbase+0x0068: 0x0a00     (TCO1_CNT)
pmbase+0x006a: 0x0008     (TCO2_CNT)
pmbase+0x006c: 0x0000     (TCO_MESSAGE)
pmbase+0x006e: 0x00       (TCO_WDCNT)
pmbase+0x006f: 0x00       (RESERVED)
pmbase+0x0070: 0x03       (SW_IRQ_GEN)
pmbase+0x0071: 0x00       (RESERVED)
pmbase+0x0072: 0x0032     (TCO_TMR)
pmbase+0x0074: 0x00000000 (RESERVED)
pmbase+0x0078: 0x00000000 (RESERVED)
pmbase+0x007c: 0x00000000 (RESERVED)



============= MCHBAR ============

MCHBAR = 0xfed10000 (MEM)

0x0004: 0x00001d70
0x0008: 0x00000006
0x000c: 0x00053239
0x0010: 0x02402136
0x0014: 0x02401f36
0x0020: 0x00019230
0x0024: 0x00019130
0x0030: 0x000000ff
0x0034: 0x00001011
0x0104: 0x00001d70
0x0108: 0x00000006
0x010c: 0x00053239
0x0110: 0x02211f03
0x0114: 0x02112102
0x0120: 0x00019533
0x0124: 0x00019230
0x0130: 0x000000ff
0x0134: 0x00001011
0x0204: 0x00001d70
0x0208: 0x00000006
0x020c: 0x00053239
0x0210: 0x02101e1f
0x0214: 0x02102020
0x0220: 0x00018320
0x0224: 0x00018321
0x0230: 0x000000ff
0x0234: 0x00001011
0x0304: 0x00001d70
0x0308: 0x00000006
0x030c: 0x00053239
0x0310: 0x02102227
0x0314: 0x02202225
0x0320: 0x00018926
0x0324: 0x00018723
0x0330: 0x000000ff
0x0334: 0x00001011
0x0404: 0xffffffff
0x0408: 0x0000ffff
0x040c: 0x00053239
0x0410: 0x0201200d
0x0414: 0x01f1210d
0x0420: 0x0009ac0a
0x0424: 0x0009ab0a
0x0430: 0x000000ff
0x0434: 0x00001011
0x0504: 0xffffffff
0x0508: 0x0000ffff
0x050c: 0x00053239
0x0510: 0x02412016
0x0514: 0x02212214
0x0520: 0x0009b410
0x0524: 0x0009b10e
0x0530: 0x000000ff
0x0534: 0x00001011
0x0604: 0xffffffff
0x0608: 0x0000ffff
0x060c: 0x00053239
0x0610: 0x02102008
0x0614: 0x02301f0b
0x0620: 0x00092d0b
0x0624: 0x00092f0e
0x0630: 0x000000ff
0x0634: 0x00001011
0x0704: 0xffffffff
0x0708: 0x0000ffff
0x070c: 0x00053239
0x0710: 0x02201f12
0x0714: 0x02001f10
0x0720: 0x00093110
0x0724: 0x00093112
0x0730: 0x000000ff
0x0734: 0x00001011
0x080c: 0x00053239
0x0830: 0x000000ff
0x0834: 0x00001011
0x090c: 0x00053239
0x0930: 0x000000ff
0x0934: 0x00001011
0x0a00: 0x00000003
0x0a04: 0x00074225
0x0a08: 0x0007422a
0x0a0c: 0x01fe4042
0x0a10: 0x00003fff
0x0b00: 0x00000003
0x0b04: 0x00074225
0x0b08: 0x0007422a
0x0b0c: 0x01fe4086
0x0b10: 0x00003fff
0x0c00: 0x00000003
0x0c04: 0x0007422c
0x0c14: 0x032cb30e
0x0c1c: 0x000002ff
0x0c20: 0x0000ff00
0x0c34: 0x00001011
0x0d00: 0x00000003
0x0d04: 0x0007422c
0x0d14: 0x032cb311
0x0d1c: 0x000002ff
0x0d20: 0x0000ffff
0x0d34: 0x00001011
0x0e00: 0x00000003
0x0e04: 0x00074225
0x0e08: 0x0007422a
0x0e0c: 0x01fe4042
0x0e10: 0x00003fff
0x0f00: 0x00000003
0x0f04: 0x00074225
0x0f08: 0x0007422a
0x0f0c: 0x01fe4086
0x0f10: 0x00003fff
0x1004: 0xffffffff
0x100c: 0x00053239
0x1010: 0x02321f29
0x1014: 0x02421d2a
0x1020: 0x00028322
0x1024: 0x00028221
0x1030: 0x000000ff
0x1034: 0x00001011
0x1104: 0xffffffff
0x110c: 0x00053239
0x1110: 0x02422239
0x1114: 0x02422235
0x1120: 0x00028320
0x1124: 0x0002821f
0x1130: 0x000000ff
0x1134: 0x00001011
0x1204: 0xffffffff
0x1208: 0x0000ffff
0x120c: 0x00053239
0x1210: 0x02111e2b
0x1214: 0x02011f2d
0x1220: 0x0009bb1b
0x1224: 0x0009ba1a
0x1230: 0x000000ff
0x1234: 0x00001011
0x1304: 0xffffffff
0x1308: 0x0000ffff
0x130c: 0x00053239
0x1310: 0x02112037
0x1314: 0x02112039
0x1320: 0x0009bd1b
0x1324: 0x0009ba18
0x1330: 0x000000ff
0x1334: 0x00001011
0x1404: 0xffffffff
0x140c: 0x00053239
0x1410: 0x02121f11
0x1414: 0x02022011
0x1420: 0x00021d3b
0x1424: 0x00021e3b
0x1430: 0x000000ff
0x1434: 0x00001011
0x1504: 0xffffffff
0x150c: 0x00053239
0x1510: 0x02422217
0x1514: 0x02322216
0x1520: 0x000a2400
0x1524: 0x0002203c
0x1530: 0x000000ff
0x1534: 0x00001011
0x1604: 0xffffffff
0x160c: 0x00053239
0x1610: 0x02221f0f
0x1614: 0x02222010
0x1620: 0x00020423
0x1624: 0x00020422
0x1630: 0x000000ff
0x1634: 0x00001011
0x1704: 0xffffffff
0x170c: 0x00053239
0x1710: 0x02121d1a
0x1714: 0x02021f1c
0x1720: 0x00020a28
0x1724: 0x00020725
0x1730: 0x000000ff
0x1734: 0x00001011
0x1810: 0x24914924
0x1814: 0x0c6671e4
0x1818: 0x00000400
0x1910: 0x24914924
0x1914: 0x0c6671e4
0x1918: 0x00000400



============= EPBAR =============

Error: Dumping EPBAR on this northbridge is not (yet) supported.



============= DMIBAR ============

DMIBAR = 0xfed18000 (MEM)

0x0000: 0x04010002
0x0004: 0x00000001
0x0010: 0x00000001
0x0014: 0x80000019
0x001c: 0x00008001
0x0020: 0x81000022
0x0028: 0x00000001
0x002c: 0x82000044
0x0034: 0x00008000
0x0038: 0x87000080
0x0040: 0x08010005
0x0044: 0x01010202
0x0050: 0x00020001
0x0058: 0xfed1c000
0x0060: 0x00010001
0x0068: 0xfed19000
0x0080: 0x00010006
0x0084: 0x0041ac42
0x0088: 0x00420003
0x0098: 0x00000002
0x00f0: 0x00000800
0x00f4: 0x00050020
0x00fc: 0x00100001
0x01c0: 0x00010001
0x01cc: 0x00060010
0x01d4: 0x00002000
0x01f8: 0x00010000
0x01fc: 0x7ca01000
0x0200: 0x80000000
0x0204: 0x00f78000
0x0208: 0x000004b0
0x0214: 0x000a000f
0x0218: 0x0e9b0b3c
0x021c: 0x0b3d0b3d
0x0224: 0x97410007
0x022c: 0x00c2403c
0x0230: 0x2800000c
0x0234: 0x4abcb5bc
0x0238: 0x202c02c3
0x0250: 0x08d00320
0x0254: 0x000c0f10
0x0258: 0x60000600
0x025c: 0x14084c60
0x0300: 0x00350ee3
0x0304: 0x00450f23
0x0308: 0x000c0040
0x030c: 0x00b80a4c
0x0310: 0x00b90a4d
0x0314: 0x000c0000
0x0318: 0x00820d5f
0x031c: 0x00920d9f
0x0320: 0x30073007
0x0324: 0x30083008
0x032c: 0x000c0028
0x0330: 0x000c0000
0x0334: 0x000c0028
0x0338: 0x000c0000
0x0344: 0x000c0028
0x0348: 0x000b0000
0x039c: 0x00100040
0x03b8: 0x005202ac
0x03bc: 0x006202ec
0x03d8: 0x007c0df0
0x03dc: 0x008c0e30
0x0400: 0x1401000b
0x0404: 0x0c000001
0x0408: 0x0010100d
0x040c: 0x02800063
0x0410: 0x00000003
0x0414: 0x00000002
0x0418: 0x00000001
0x041c: 0x00800000
0x0428: 0x00400002
0x0438: 0x0000000f
0x0440: 0x000e0b00
0x0448: 0xffff0000
0x044c: 0xffff0000
0x0468: 0x06000084
0x046c: 0x00000f00
0x0470: 0xabc2d6bc
0x0474: 0x0000ffff
0x0490: 0x10000000
0x04b8: 0x000000fa
0x04bc: 0x0000c8c8
0x0508: 0x00000001
0x0530: 0x55e63b90
0x0534: 0x77ebc1c0
0x0560: 0x00000100
0x0700: 0x45fb9008
0x0720: 0x45fb9008
0x0804: 0x00000001
0x0900: 0x50000000
0x0904: 0x2a1846ec
0x0908: 0x51ffffff
0x090c: 0x00000128
0x0910: 0x00004300
0x0914: 0x98200280
0x091c: 0x00020000
0x0920: 0x50000000
0x0924: 0x2a1846ec
0x0928: 0x51ffffff
0x092c: 0x00000128
0x0930: 0x00004300
0x0934: 0x98200280
0x093c: 0x00020000
0x0a00: 0x03242018
0x0a04: 0x0c0718f0
0x0a08: 0x06208300
0x0a0c: 0x00000080
0x0a10: 0x03242018
0x0a14: 0x0c0718f0
0x0a18: 0x06208300
0x0a1c: 0x00000080
0x0a20: 0x03242018
0x0a24: 0x0c0718f0
0x0a28: 0x06208300
0x0a2c: 0x00000080
0x0a30: 0x03242018
0x0a34: 0x0c0718f0
0x0a38: 0x06208300
0x0a3c: 0x00000080
0x0b80: 0x00000200
0x0b98: 0x00001c20
0x0ba4: 0x00000008
0x0ba8: 0x00e00014
0x0c00: 0x07700c08
0x0c04: 0x2e680008
0x0c08: 0x100c5843
0x0c0c: 0x16063400
0x0c10: 0x00000100
0x0c14: 0x0e004000
0x0c18: 0x00000054
0x0c1c: 0xa0202000
0x0c24: 0xa0840080
0x0c28: 0x0003a091
0x0c30: 0x40024000
0x0c38: 0x18000402
0x0c40: 0x00003ff1
0x0c44: 0x00003ff2
0x0c4c: 0x00000231
0x0c50: 0x00000020
0x0ccc: 0x00000001
0x0cd4: 0xff0000ff
0x0cd8: 0x00005000
0x0cdc: 0xc1ff0113
0x0d10: 0xffff0000
0x0d14: 0xffff0000
0x0d1c: 0x00000040
0x0d34: 0x0000005f
0x0d6c: 0x400204e0
0x0d70: 0x8000abf5
0x0d74: 0x000146ec
0x0d78: 0x0000043a
0x0d7c: 0x0002000f
0x0d80: 0xfba84aa8
0x0d84: 0x00ff03d7
0x0dc0: 0x3400fbc0
0x0dc4: 0x0037100a
0x0dc8: 0x00f80236
0x0dcc: 0x36200e06
0x0dd0: 0x0836b180
0x0dd4: 0x00d0a22e
0x0ddc: 0x00014a80
0x0e0c: 0x20000000
0x0e1c: 0x20000000
0x0e2c: 0x20000000
0x0e3c: 0x20000000


========= PCIEXBAR ========

Error: Dumping PCIEXBAR on this northbridge is not (yet) supported.


Error: Dumping MSRs on this CPU (0x0306a0) is not (yet) supported.



============= AMBs ============

