superiotool r4.0-6318-g480790b
Found SMSC FDC37C932 (id=0x02, rev=0x02) at 0x2e
Register dump:
idx 02 03 20 21 22 23 24 2d  2e 2f
val 02 02 02 02 02 02 02 02  02 02
def 00 03 02 01 00 00 04 NA  NA 00
LDN 0x00 (Floppy)
idx 30 60 61 70 74 f0 f1 f2  f4 f5
val 00 00 00 00 00 00 00 00  00 00
def 00 03 f0 06 02 0e 00 ff  00 00
LDN 0x01 (IDE 1)
idx 30 60 61 62 63 70
val 01 01 01 01 01 01
def 00 01 f0 03 f6 0e
LDN 0x02 (IDE 2)
idx 30 60 61 62 63 70 f0
val 02 02 02 02 02 02 02
def 00 00 00 00 00 00 00
LDN 0x03 (Parallel port)
idx 30 60 61 70 74 f0
val 03 03 03 03 03 03
def 00 00 00 00 04 3c
LDN 0x04 (COM1)
idx 30 60 61 70 f0
val 04 04 04 04 04
def 00 00 00 00 00
LDN 0x05 (COM2)
idx 30 60 61 70 f0 f1
val 05 05 05 05 05 05
def 00 00 00 00 00 00
LDN 0x06 (Real-time clock (RTC))
idx 30 70 f0 f1 f2 f3 f4 f5  f6
val 06 06 06 06 06 06 06 06  06
def 00 00 00 00 00 NA MM NA  NA
LDN 0x07 (Keyboard)
idx 30 70 72
val 07 07 07
def 00 00 00
LDN 0x08 (Aux I/O)
idx 30 60 61 62 63 e0 e1 e2  e3 e4 e5 e6 e7 e8 e9 ea  eb ec ed f0 f1 f2 f3 f4
val 08 08 08 08 08 08 08 08  08 08 08 08 08 08 08 08  08 08 08 08 08 08 08 08
def 00 00 00 00 00 01 01 01  01 01 01 01 01 01 01 01  01 01 01 00 00 00 00 MM
No extra registers known for this chip.
